{
  "$schema": "https://json-schema.org/draft/2020-12/schema",
  "$id": "https://rosetta-shape-core/schema/shape.schema.json",
  "title": "Rosetta Shape",
  "type": "object",
  "required": [
    "id",
    "name",
    "families"
  ],
  "properties": {
    "id": {
      "type": "string",
      "pattern": "^SHAPE\\.[A-Z0-9_]+$"
    },
    "name": {
      "type": "string"
    },
    "description": {
      "type": "string"
    },
    "faces": {
      "type": [
        "integer",
        "null"
      ]
    },
    "edges": {
      "type": [
        "integer",
        "null"
      ]
    },
    "vertices": {
      "type": [
        "integer",
        "null"
      ]
    },
    "families": {
      "type": "array",
      "items": {
        "type": "string"
      }
    },
    "equation_families": {
      "type": "array",
      "items": {
        "type": "string"
      }
    },
    "principles": {
      "type": "array",
      "items": {
        "type": "string"
      }
    },
    "shape_class": {
      "type": "string",
      "enum": [
        "platonic",
        "emergent",
        "derived"
      ],
      "description": "Shape classification. Platonic = static solid. Emergent = dynamic form arising from field interactions. Derived = constructed from other shapes."
    },
    "derived_from": {
      "type": "array",
      "items": {
        "type": "string"
      }
    },
    "polyhedral": {
      "type": "object",
      "required": [
        "maps_to"
      ],
      "properties": {
        "maps_to": {
          "type": "string"
        },
        "note": {
          "type": "string"
        }
      },
      "additionalProperties": false
    },
    "bridges": {
      "type": "object",
      "properties": {
        "sensors": {
          "type": "array",
          "items": {
            "type": "string"
          }
        },
        "glyphs": {
          "type": "array",
          "items": {
            "type": "string"
          }
        },
        "protocols": {
          "type": "array",
          "items": {
            "type": "string"
          }
        },
        "defenses": {
          "type": "array",
          "items": {
            "type": "string"
          }
        },
        "audit_glyphs": {
          "type": "array",
          "items": {
            "type": "string"
          }
        },
        "bridge_glyphs": {
          "type": "array",
          "items": {
            "type": "string"
          }
        }
      },
      "additionalProperties": false
    },
    "provenance": {
      "type": "object",
      "properties": {
        "version": {
          "type": "string"
        },
        "updated": {
          "type": "string"
        },
        "derived_from_event": {
          "type": "string"
        },
        "participants": {
          "type": "array",
          "items": {
            "type": "string"
          }
        },
        "cross_repo": {
          "type": "array",
          "items": {
            "type": "string"
          }
        }
      },
      "additionalProperties": false
    },
    "felt_anchor": {
      "type": "object"
    },
    "PAD_profile": {
      "type": "object"
    },
    "decay_model": {
      "type": "object"
    },
    "ontology_links": {
      "type": "array",
      "items": {
        "type": "object",
        "properties": {
          "to": {
            "type": "string"
          },
          "type": {
            "type": "string"
          },
          "notes": {
            "type": "string"
          }
        }
      }
    },
    "open_questions": {
      "type": "array"
    },
    "noise_signature": {
      "type": "array"
    },
    "octahedral_states": {
      "type": "object",
      "description": "Octahedral encoding metadata. Maps shape vertices to 3-bit states with eigenvalue triples and φ-coherence scores.",
      "properties": {
        "total_states": {
          "type": "integer"
        },
        "bits_per_state": {
          "type": "integer"
        },
        "ground_state": {
          "type": "integer"
        },
        "phi_coherence_range": {
          "type": "array",
          "items": {
            "type": "number"
          },
          "minItems": 2,
          "maxItems": 2
        },
        "stability_order": {
          "type": "array",
          "items": {
            "type": "integer"
          }
        },
        "energy_model": {
          "type": "string"
        },
        "encoding_source": {
          "type": "string"
        }
      },
      "additionalProperties": false
    },
    "read_class": {
      "type": "string",
      "enum": [
        "shape_entry",
        "geometry_note"
      ],
      "description": "Against SHAPE_SPEC.md section 10. A shape entry carries solving-for, a constraint list, why-not-the-other-geometry and a removal test. A record missing the removal test is a geometry note and is marked as one. Shape reads live in data/rosetta/shape_reads.jsonl under schema/shape_read.schema.json."
    },
    "read_note": {
      "type": "string"
    }
  },
  "additionalProperties": false
}
