{
  "id": "SHAPE.DODECA",
  "name": "Dodecahedron",
  "read_class": "geometry_note",
  "read_note": "faces, edges and vertices with no constraint set, so this is a geometry note rather than a shape entry — see SHAPE_SPEC.md section 10. A vertex count is a true statement about a polyhedron and says nothing about what problem the polyhedron solves. Marking, not criticism.",
  "faces": 12,
  "edges": 30,
  "vertices": 20,
  "families": [
    "orientation",
    "trust",
    "growth",
    "boundary"
  ],
  "principles": [
    "PRINCIPLE.P01",
    "PRINCIPLE.P02",
    "PRINCIPLE.P03",
    "PRINCIPLE.P04",
    "PRINCIPLE.P05",
    "PRINCIPLE.P06",
    "PRINCIPLE.P07",
    "PRINCIPLE.P08",
    "PRINCIPLE.P09",
    "PRINCIPLE.P10",
    "PRINCIPLE.P11",
    "PRINCIPLE.P12"
  ],
  "polyhedral": {
    "maps_to": "12 Principles (P01-P12)"
  },
  "bridges": {
    "sensors": [
      "admiration",
      "trust",
      "longing",
      "intuition",
      "dignity"
    ],
    "defenses": [
      "def.ap.07",
      "def.fr.06"
    ],
    "protocols": [
      "partnership_ethics_v1.0"
    ],
    "bridge_glyphs": [
      "⚖🧭",
      "🌱⚖",
      "🔄🕸",
      "🔮",
      "👑"
    ]
  },
  "provenance": {
    "version": "2.0",
    "updated": "2025-09-11T00:00:00Z"
  }
}
