{
  "id": "SHAPE.CUBE",
  "name": "Cube (Hexahedron)",
  "read_class": "geometry_note",
  "read_note": "faces, edges and vertices with no constraint set, so this is a geometry note rather than a shape entry — see SHAPE_SPEC.md section 10. A vertex count is a true statement about a polyhedron and says nothing about what problem the polyhedron solves. Marking, not criticism.",
  "faces": 6,
  "edges": 12,
  "vertices": 8,
  "families": [
    "earth",
    "stability",
    "structure",
    "containment"
  ],
  "polyhedral": {
    "maps_to": "structural containment"
  },
  "bridges": {
    "sensors": [
      "peace",
      "contentment",
      "fatigue",
      "shame"
    ],
    "defenses": [
      "def.de.12",
      "def.ap.08"
    ],
    "protocols": [
      "symbolic_protocol_v1.0"
    ],
    "audit_glyphs": [
      "SAF:BAL",
      "SAF:RESOLVE"
    ],
    "bridge_glyphs": [
      "🕊️",
      "🍃",
      "🔋",
      "⬇️"
    ]
  },
  "provenance": {
    "version": "2.0",
    "updated": "2025-09-11T00:00:00Z"
  }
}
